,Title,Id,Upvotes,body,body_clean,no_stops
691,Need a Lift?,q6s3u5,271,"It's that time of year again: you need to go to New York City so you can take a selfie in Central Park. Unfortunately, you're in a rush (break ends tomorrow and you still have an essay to write!), so you don't have time plan a trip via bus, nor do you have a car so you can't go yourself. Dejected, you resign yourself to not being able to take a selfie under the skyscrapers. But wait! You see a post on the Cornell subreddit: ""Traveling to NYC today, anyone need a lift?"" How generous -- a total stranger is offering to drive you to NYC for free!

You DM them on Reddit and work out a meeting location. A few hours later, you meet them just outside campus and get in their car, and you set off for NYC. Everything goes well at first, although the inside of their car is plastered with essay drafts. You think that's odd, but don't read their contents -- after all, he's giving you a free ride, what gives you the right to be nosy?

About a half an hour into the drive, the driver turns off the radio, turns around, and smiles at you.

""Sure is great being at Cornell, huh?""

""Sure"", you respond.

""Yeah, there are so many things I love about campus."" There's a worrying air to his vagueness. ""The academics, the campus, the culture..."" he trails off, still looking directly at you. ""Hey, what do *you* think makes Cornell so special?""

Oh no.

Oh no no no no no. You check the doors. They're locked. You look around for a weapon, anything to break the windows open with, but no success. You are trapped in the car with a prospective applicant, and there's no way he'll let you leave until you write his essay for him.

""Listen, I don't want to bother you, I just re*all*y need a li*ttle*... *inspi*ration,,,"" he twitches, with a pained, deranged smile. ""*Don't* think of it like *copyi*ng, think of it like *helpi*ng a *friend*."" He pulls out a switchblade and looks at it lovingly, then stares directly into your soul. ""Won't y*ou g*ive me some in*spira*tion?""

He's still not looking at the road. You look in front of the car, transfixed: a hero is slowly levitating down from the heavens. They land on the road and outstretch their hand. The car impacts the palm and is immediately crumpled by its momentum, as if the mystery superhero was made of solid stone. The applicant, still looking away from the road, barely had any time to process what was happening before he was flung through the windshield and onto the pavement. Then your head hits the headrest and everything goes black.

&#x200B;

You wake up outside the car. You feel fine, but your vision is a bit blurry. You see the applicant on the pavement, injured and withering. He notices the superhero towering over him and feebly tries to crawl away, then flips on his back, looks up at the superhero, and pleads: ""No, please, I just needed some inspiration -- it's an exception, I swear, please, it's an exception -- don't""

The superhero closes their eyes. Chains erupt from the ground around the applicant and encircle him in a web of twisted steel. A titanium padlock materializes out of thin air and locks the chains together, trapping the applicant for all eternity. Your vision is clearing, and you're finally able to make out the superhero. It's /u/pw11111. They open their eyes, look at you, and smile. Then they look back at the defeated applicant.

""Locked. Please direct all admissions related posts to the megathread.""","It's time year again: need go New York City take selfie Central Park. Unfortunately, rush (break ends tomorrow still essay write!), time plan trip via bus, car can't go yourself. Dejected, resign able take selfie skyscrapers. But wait! You see post Cornell subreddit: ""Traveling NYC today, anyone need lift?"" How generous -- total stranger offering drive NYC free! You DM Reddit work meeting location. A hours later, meet outside campus get car, set NYC. Everything goes well first, although inside car plastered essay drafts. You think that's odd, read contents -- all, he's giving free ride, gives right nosy? About half hour drive, driver turns radio, turns around, smiles you. ""Sure great Cornell, huh?"" ""Sure"", respond. ""Yeah, many things I love campus."" There's worrying air vagueness. ""The academics, campus, culture..."" trails off, still looking directly you. ""Hey, *you* think makes Cornell special?"" Oh no. Oh no. You check doors. They're locked. You look around weapon, anything break windows open with, success. You trapped car prospective applicant, there's way he'll let leave write essay him. ""Listen, I want bother you, I re*all*y need li*ttle*... *inspi*ration,,,"" twitches, pained, deranged smile. ""*Don't* think like *copyi*ng, think like *helpi*ng *friend*."" He pulls switchblade looks lovingly, stares directly soul. ""Won't y*ou g*ive in*spira*tion?"" He's still looking road. You look front car, transfixed: hero slowly levitating heavens. They land road outstretch hand. The car impacts palm immediately crumpled momentum, mystery superhero made solid stone. The applicant, still looking away road, barely time process happening flung windshield onto pavement. Then head hits headrest everything goes black. &#x200B; You wake outside car. You feel fine, vision bit blurry. You see applicant pavement, injured withering. He notices superhero towering feebly tries crawl away, flips back, looks superhero, pleads: ""No, please, I needed inspiration -- exception, I swear, please, exception -- don't"" The superhero closes eyes. Chains erupt ground around applicant encircle web twisted steel. A titanium padlock materializes thin air locks chains together, trapping applicant eternity. Your vision clearing, finally able make superhero. It's /u/pw11111. They open eyes, look you, smile. Then look back defeated applicant. ""Locked. Please direct admissions related posts megathread.""",Its time year again need go New York City take selfie Central Park Unfortunately rush break ends tomorrow still essay write time plan trip via bus car cant go yourself Dejected resign able take selfie skyscrapers But wait You see post Cornell subreddit Traveling NYC today anyone need lift How generous  total stranger offering drive NYC free You DM Reddit work meeting location A hours later meet outside campus get car set NYC Everything goes well first although inside car plastered essay drafts You think thats odd read contents  all hes giving free ride gives right nosy About half hour drive driver turns radio turns around smiles you Sure great Cornell huh Sure respond Yeah many things I love campus Theres worrying air vagueness The academics campus culture trails off still looking directly you Hey you think makes Cornell special Oh no Oh no You check doors Theyre locked You look around weapon anything break windows open with success You trapped car prospective applicant theres way hell let leave write essay him Listen I want bother you I really need little inspiration twitches pained deranged smile Dont think like copying think like helping friend He pulls switchblade looks lovingly stares directly soul Wont you give inspiration Hes still looking road You look front car transfixed hero slowly levitating heavens They land road outstretch hand The car impacts palm immediately crumpled momentum mystery superhero made solid stone The applicant still looking away road barely time process happening flung windshield onto pavement Then head hits headrest everything goes black x200B You wake outside car You feel fine vision bit blurry You see applicant pavement injured withering He notices superhero towering feebly tries crawl away flips back looks superhero pleads No please I needed inspiration  exception I swear please exception  dont The superhero closes eyes Chains erupt ground around applicant encircle web twisted steel A titanium padlock materializes thin air locks chains together trapping applicant eternity Your vision clearing finally able make superhero Its upw11111 They open eyes look you smile Then look back defeated applicant Locked Please direct admissions related posts megathread
692,Cornell Twitter admin is on one today I guess,oeyrxh,275,,,
693,GOOS.,lt5nd7,274,,,
694,"My guinea pig looks kinda weird, but she wishes all of you luck on your finals!",kgcr3e,275,,,
695,Grateful,jzb5ol,272,"With everything going on in the world, this sure is hell is an incredible place to be right now. Being at Cornell and in the US in general is just such a surreal opportunity. Life is really good here and however hard it gets I’m just reminded of how lucky I am to be here. Particular to be able to have an in person experience during a global pandemic. As an international student, I am especially reminded of how rare and magnificent this opportunity is to be around so many diverse and bright people. Not to mention the strong career that comes out of this. 

I just hope that more people take a moment out of their stress and frustration with exams or the SA or life right now and just appreciate how good things are. Happy Thanksgiving everyone!","With everything going world, sure hell incredible place right now. Being Cornell US general surreal opportunity. Life really good however hard gets I’m reminded lucky I here. Particular able person experience global pandemic. As international student, I especially reminded rare magnificent opportunity around many diverse bright people. Not mention strong career comes this. I hope people take moment stress frustration exams SA life right appreciate good things are. Happy Thanksgiving everyone!",With everything going world sure hell incredible place right now Being Cornell US general surreal opportunity Life really good however hard gets I’m reminded lucky I here Particular able person experience global pandemic As international student I especially reminded rare magnificent opportunity around many diverse bright people Not mention strong career comes this I hope people take moment stress frustration exams SA life right appreciate good things are Happy Thanksgiving everyone
696,Greetings from Martha Pollack,hz9lna,275,"Hi, this is Martha Pollack speaking. It has recently come to my attention that some of you are worried about booking flights back to Ithaca. It appears that you cannot book a flight until you know the date that you need to arrive at your destination, and unfortunately, we have withheld that information from you, as we haven’t quite decided what font we should use for the corresponding announcement email. In this regard, I sincerely apologize; I was under the impression that every student has a private plane and that they can arrive whenever they please. Apparently though, y’all poor af (but also my b cuz I’m taking like $70,000 a year from each of you mofos). Anyways, long story short, I’m flying to the Bahamas tomorrow for a Bridge tournament, so it’s kinda too late to fix this, but you may still want to consider investing in a jet, as this will make future travel easier (sell off your car collections if you need money to fund this; trust me it’s worth it).

To help students deal with the mental stress this may be causing, I will be giving a $1 tuition refund to all students who do not own a private jet. Our mental health experts recently ran a mathematical model which showed that such a refund will drastically reduce stress for students*. Details about this refund will be released sometime in the next 1 to 254 weeks. Unfortunately, running the previously mentioned mathematical model was very expensive, so we will also have to increase tuition by 50 cents per student. But hey, that’s just 1,999,999.50 more dollars that you need till you can get that plane!!

Warmest regards,

Martha Pollack 

*model assumes 100% of students have zero dollars to begin with, such that the $1 refund leads to an infinite increase in student wealth. Model has an uncertainty range of - infinity to + infinity.","Hi, Martha Pollack speaking. It recently come attention worried booking flights back Ithaca. It appears cannot book flight know date need arrive destination, unfortunately, withheld information you, haven’t quite decided font use corresponding announcement email. In regard, I sincerely apologize; I impression every student private plane arrive whenever please. Apparently though, y’all poor af (but also b cuz I’m taking like $70,000 year mofos). Anyways, long story short, I’m flying Bahamas tomorrow Bridge tournament, it’s kinda late fix this, may still want consider investing jet, make future travel easier (sell car collections need money fund this; trust it’s worth it). To help students deal mental stress may causing, I giving $1 tuition refund students private jet. Our mental health experts recently ran mathematical model showed refund drastically reduce stress students*. Details refund released sometime next 1 254 weeks. Unfortunately, running previously mentioned mathematical model expensive, also increase tuition 50 cents per student. But hey, that’s 1,999,999.50 dollars need till get plane!! Warmest regards, Martha Pollack *model assumes 100% students zero dollars begin with, $1 refund leads infinite increase student wealth. Model uncertainty range - infinity + infinity.",Hi Martha Pollack speaking It recently come attention worried booking flights back Ithaca It appears cannot book flight know date need arrive destination unfortunately withheld information you haven’t quite decided font use corresponding announcement email In regard I sincerely apologize I impression every student private plane arrive whenever please Apparently though y’all poor af but also b cuz I’m taking like 70000 year mofos Anyways long story short I’m flying Bahamas tomorrow Bridge tournament it’s kinda late fix this may still want consider investing jet make future travel easier sell car collections need money fund this trust it’s worth it To help students deal mental stress may causing I giving 1 tuition refund students private jet Our mental health experts recently ran mathematical model showed refund drastically reduce stress students Details refund released sometime next 1 254 weeks Unfortunately running previously mentioned mathematical model expensive also increase tuition 50 cents per student But hey that’s 199999950 dollars need till get plane Warmest regards Martha Pollack model assumes 100 students zero dollars begin with 1 refund leads infinite increase student wealth Model uncertainty range  infinity  infinity
697,Ezra Can’t Breathe,gul0jk,277,,,
698,"Photo of Cornell’s 1953 football team, broken down by “field of study”",ep6vir,271,,,
699,how Cornell random group projects be lookin 😭,tu2v5e,274,,,
700,Trying my best not to cough on the bus to NY so I don’t get kicked out in some unknown town in Pennsylvania,rinfu7,271,,,
701,I don't want break to be over,q6q0ea,272,*title,*title,title
702,The fog and my camera teamed up to create this pretty crazy image of Schwartz last night,n5c1e9,269,,,
703,someone put a tree on A.D. White,m9dl10,275,,,
704,Sunsets hitting different lately,m1jw9j,276,,,
705,Cornell Alpha Fund is a club with no fiscal responsibility AT ALL. Fuck this club.,krh9vr,275,"Basically, this club was devoted to pitching stocks for a portfolio and investing money from the members into this mock portfolio. We separated out into sectors and pitched stocks for each of our respective sectors, then used member-contributed money to act on investment theses. We had a contract stating that this was the purpose of the funds given to the club by each member. We were expecting the contributed money to be reimbursed back when the member graduated or left the club.

The club investment manager went rogue from our investment theses and much of the club money into options INSTEAD of the stocks we worked hard to pitch. The $20,000 contributed capital by the members because of this manager is now worth $800. So, fiscal irresponsibility from the manager right there. Then, the club head had the audacity to say that I would be responsible for trying to be reimbursed my principal that was improperly allocated— with the only avenue of punishment that he exercised was kicking this manager from the club. I would have to pursue the kicked manager  to get my principal back that he violated the financial allocation agreement for. The club head can’t get in contact with him at all because the former manager isn’t responding to emails. Fuck this club. The money I put in was a lot to me, and I put it in hoping that I could make returns on it in the long run. Instead, I have to eat a loss because someone went rogue, and the club management are too much of pussies to do anything beyond emailing this kicked member. FUCK CORNELL ALPHA FUND.","Basically, club devoted pitching stocks portfolio investing money members mock portfolio. We separated sectors pitched stocks respective sectors, used member-contributed money act investment theses. We contract stating purpose funds given club member. We expecting contributed money reimbursed back member graduated left club. The club investment manager went rogue investment theses much club money options INSTEAD stocks worked hard pitch. The $20,000 contributed capital members manager worth $800. So, fiscal irresponsibility manager right there. Then, club head audacity say I would responsible trying reimbursed principal improperly allocated— avenue punishment exercised kicking manager club. I would pursue kicked manager get principal back violated financial allocation agreement for. The club head can’t get contact former manager isn’t responding emails. Fuck club. The money I put lot me, I put hoping I could make returns long run. Instead, I eat loss someone went rogue, club management much pussies anything beyond emailing kicked member. FUCK CORNELL ALPHA FUND.",Basically club devoted pitching stocks portfolio investing money members mock portfolio We separated sectors pitched stocks respective sectors used membercontributed money act investment theses We contract stating purpose funds given club member We expecting contributed money reimbursed back member graduated left club The club investment manager went rogue investment theses much club money options INSTEAD stocks worked hard pitch The 20000 contributed capital members manager worth 800 So fiscal irresponsibility manager right there Then club head audacity say I would responsible trying reimbursed principal improperly allocated— avenue punishment exercised kicking manager club I would pursue kicked manager get principal back violated financial allocation agreement for The club head can’t get contact former manager isn’t responding emails Fuck club The money I put lot me I put hoping I could make returns long run Instead I eat loss someone went rogue club management much pussies anything beyond emailing kicked member FUCK CORNELL ALPHA FUND
706,Cornell University Hates Low-Income Students,izlq6k,272,"Rich kids of r/Cornell can downvote this all you want (and the ""I'm not rich, I'm upper MIDDLE CLASS"" kids). But this post is not for you, it is a warning to low income students come Spring, especially those who think that Cornell will reevaluate their aid after accepting their offers.

Don't get me wrong, I feel like I've grown literal superpowers in CS after taking some of the interesting courses here like 2112, 3110, and now 4820, but the fact of the matter is that I had to spend my first year quite literally starving because Cornell refused to adjust the parental contribution based on my noncustodials income from 2 years ago (and he has long since been unemployed -- and my aid appeals have long been repeatedly ignored on ridiculous stinginess of the FA office). 

Out of the advice of the ever all-knowing, low-income student-loving FA office (an excuse to not grant my aid appeal), I stayed home in this sh*thole neighborhood with my mother, only for them to take out the cost of housing out of my PELL GRANT and Cornell Grant.

Nevermind my own personal experiences with FA, the student atmosphere here regarding poor kids is the fucking worst. Meeting people and them having a conversation about how they hate that other kids get financial aid is awkward and will make you feel guilty. Them asking you why your room isn't embezzled in decorations and supplies (printers, coffee machines, etc) when the real answer is that you couldn't justify spending that money fucking hurts. 

In the end, I do still think going to Cornell is a net positive -- by a long shot. But it definitely does suck having to worry about an empty stomach and finances while already being stressed with my coursework. Prospective low-income students take this anecdote as you please ^","Rich kids r/Cornell downvote want (and ""I'm rich, I'm upper MIDDLE CLASS"" kids). But post you, warning low income students come Spring, especially think Cornell reevaluate aid accepting offers. Don't get wrong, I feel like I've grown literal superpowers CS taking interesting courses like 2112, 3110, 4820, fact matter I spend first year quite literally starving Cornell refused adjust parental contribution based noncustodials income 2 years ago (and long since unemployed -- aid appeals long repeatedly ignored ridiculous stinginess FA office). Out advice ever all-knowing, low-income student-loving FA office (an excuse grant aid appeal), I stayed home sh*thole neighborhood mother, take cost housing PELL GRANT Cornell Grant. Nevermind personal experiences FA, student atmosphere regarding poor kids fucking worst. Meeting people conversation hate kids get financial aid awkward make feel guilty. Them asking room embezzled decorations supplies (printers, coffee machines, etc) real answer justify spending money fucking hurts. In end, I still think going Cornell net positive -- long shot. But definitely suck worry empty stomach finances already stressed coursework. Prospective low-income students take anecdote please ^",Rich kids rCornell downvote want and Im rich Im upper MIDDLE CLASS kids But post you warning low income students come Spring especially think Cornell reevaluate aid accepting offers Dont get wrong I feel like Ive grown literal superpowers CS taking interesting courses like 2112 3110 4820 fact matter I spend first year quite literally starving Cornell refused adjust parental contribution based noncustodials income 2 years ago and long since unemployed  aid appeals long repeatedly ignored ridiculous stinginess FA office Out advice ever allknowing lowincome studentloving FA office an excuse grant aid appeal I stayed home shthole neighborhood mother take cost housing PELL GRANT Cornell Grant Nevermind personal experiences FA student atmosphere regarding poor kids fucking worst Meeting people conversation hate kids get financial aid awkward make feel guilty Them asking room embezzled decorations supplies printers coffee machines etc real answer justify spending money fucking hurts In end I still think going Cornell net positive  long shot But definitely suck worry empty stomach finances already stressed coursework Prospective lowincome students take anecdote please 
