,Title,Id,Upvotes,body,body_clean,no_stops
155,If you are a Cornell student- DO NOT RENT WITH DON AND MARIE EDWARDS!,ovz6sp,422,"DO NOT RENT WITH DON AND MARIE EDWARDS!  
Don is incredibly disrespectful and unprofessional. They will do anything to get your money.  
I was trying to rent a studio with Don, but he kept sending me contracts with wrong values for me to sign.   
Here is a sample of the kinds of stuff you will have to deal with:   
(Taken from the last email sent to me after I asked him to fix an extra $200 fee he was charging me for a pet I told him I am not taking with me to Ithaca)

""NO MORE !!  
You either sign the lease and initial the two pages that I am sending  
with this email, or you can look for housing elsewhere.  
ALSO-----  
I need the signed lease tonight.  
I need the PayPal payment by Sunday.""

(Then he goes ahead and sends me the wrong contract with the extra $200 fee again.)

I called him right after to ask if he could fix the contract he sent wrong 3 times, and he yells at me, ""WHAT YOU HAVE TO DO IS SEND ME THE $1500 NOW IF YOU WANT THE STUDIO!"" I told him, ""Unfortunately, I can't send you the money if the contract is not right,"" and he answered,  
""IF YOU KNEW WHAT YOU WANTED TO DO WITH YOUR LIFE, I WOULDN'T HAVE TO DEAL WITH YOUR BULLSHIT"" and hung up on me.  
I called him back again- he told me I could look for housing elsewhere and that he wouldn't deal with my bullshit.

I repeat, DO NOT MAKE DEALS WITH DON AND MARIE EDWARDS.  
They are not trustworthy, and YOU WILL HAVE PROBLEM WITH THEM IN THE FUTURE.   
HUGE RED FLAG!","DO NOT RENT WITH DON AND MARIE EDWARDS! Don incredibly disrespectful unprofessional. They anything get money. I trying rent studio Don, kept sending contracts wrong values sign. Here sample kinds stuff deal with: (Taken last email sent I asked fix extra $200 fee charging pet I told I taking Ithaca) ""NO MORE !! You either sign lease initial two pages I sending email, look housing elsewhere. ALSO----- I need signed lease tonight. I need PayPal payment Sunday."" (Then goes ahead sends wrong contract extra $200 fee again.) I called right ask could fix contract sent wrong 3 times, yells me, ""WHAT YOU HAVE TO DO IS SEND ME THE $1500 NOW IF YOU WANT THE STUDIO!"" I told him, ""Unfortunately, I can't send money contract right,"" answered, ""IF YOU KNEW WHAT YOU WANTED TO DO WITH YOUR LIFE, I WOULDN'T HAVE TO DEAL WITH YOUR BULLSHIT"" hung me. I called back again- told I could look housing elsewhere deal bullshit. I repeat, DO NOT MAKE DEALS WITH DON AND MARIE EDWARDS. They trustworthy, YOU WILL HAVE PROBLEM WITH THEM IN THE FUTURE. HUGE RED FLAG!",DO NOT RENT WITH DON AND MARIE EDWARDS Don incredibly disrespectful unprofessional They anything get money I trying rent studio Don kept sending contracts wrong values sign Here sample kinds stuff deal with Taken last email sent I asked fix extra 200 fee charging pet I told I taking Ithaca NO MORE  You either sign lease initial two pages I sending email look housing elsewhere ALSO I need signed lease tonight I need PayPal payment Sunday Then goes ahead sends wrong contract extra 200 fee again I called right ask could fix contract sent wrong 3 times yells me WHAT YOU HAVE TO DO IS SEND ME THE 1500 NOW IF YOU WANT THE STUDIO I told him Unfortunately I cant send money contract right answered IF YOU KNEW WHAT YOU WANTED TO DO WITH YOUR LIFE I WOULDNT HAVE TO DEAL WITH YOUR BULLSHIT hung me I called back again told I could look housing elsewhere deal bullshit I repeat DO NOT MAKE DEALS WITH DON AND MARIE EDWARDS They trustworthy YOU WILL HAVE PROBLEM WITH THEM IN THE FUTURE HUGE RED FLAG
156,We are all smart here,lnlbyy,419,"Distinguish yourself by being kind.

Source: an obit for a retired Cornell prof who used to say and practice these words.",Distinguish kind. Source: obit retired Cornell prof used say practice words.,Distinguish kind Source obit retired Cornell prof used say practice words
157,ever just stop and think ab how wild it is that u go to school here,u2re2m,423,Probably about once a week I’ll be walking to class or just walking around campus at night and I just start smiling bc of the waterfalls or a pretty building or just the fact that I get to say I go to Cornell,Probably week I’ll walking class walking around campus night I start smiling bc waterfalls pretty building fact I get say I go Cornell,Probably week I’ll walking class walking around campus night I start smiling bc waterfalls pretty building fact I get say I go Cornell
158,"For the first time ever, your Cornell men's hockey team and Cornell women's team are both ranked #1 in the country!",f8vrgx,414,,,
159,when your 2 factor authentication is on the same device as the one you’re using to log in,n5q0wu,418,,,
160,Thank Gries I have no social skills,euopl7,417,,,
161,I’m having an identity crisis,non5oq,419,,,
162,"A Drunken Hazing, a Fatal Fall and a Cornell Fraternity’s Silence",m453fw,413,,,
163,Hello! I teach at Cornell and have been told by a couple of students to post my rabbit here. This is Kiki.,keijjs,412,,,
164,An Update from JZ herself on the WaPo article,iibhje,413,"“Zhang said she thinks she’s been cruelly singled out. She speculated that people may be jealous of her following and “trying to get clout using my name.” Her friends on campus tell her often, she said, about other people breaking the rules at mask-less gatherings.
She says she has not reported any of what she has heard to the school” 

https://www.washingtonpost.com/education/2020/08/26/cornell-jessica-zhang-coronavirus-tiktok/

This is literally just confirmation that she 

1. Is in denial about being called out 
2. Isn’t actually sorry for what she did 
3. Trying to again deflect by saying she didn’t call out others partying so why does she deserve to get in trouble
4. a true dyson student saying ppl are talking about her out of jealousy of her following and for “clout game”. No you sociopath we are talking about you bc you literally jeopardized the community.  
5. Didn’t report mask less gatherings to not be a snitch ? Sure that will really helps us not all get sent back. 

Also she deleted her apology and reuploaded her sponsored amazon ad so guess she really cares. :)","“Zhang said thinks she’s cruelly singled out. She speculated people may jealous following “trying get clout using name.” Her friends campus tell often, said, people breaking rules mask-less gatherings. She says reported heard school” https://www.washingtonpost.com/education/2020/08/26/cornell-jessica-zhang-coronavirus-tiktok/ This literally confirmation 1. Is denial called 2. Isn’t actually sorry 3. Trying deflect saying didn’t call others partying deserve get trouble 4. true dyson student saying ppl talking jealousy following “clout game”. No sociopath talking bc literally jeopardized community. 5. Didn’t report mask less gatherings snitch ? Sure really helps us get sent back. Also deleted apology reuploaded sponsored amazon ad guess really cares. :)",“Zhang said thinks she’s cruelly singled out She speculated people may jealous following “trying get clout using name” Her friends campus tell often said people breaking rules maskless gatherings She says reported heard school” httpswwwwashingtonpostcomeducation20200826cornelljessicazhangcoronavirustiktok This literally confirmation 1 Is denial called 2 Isn’t actually sorry 3 Trying deflect saying didn’t call others partying deserve get trouble 4 true dyson student saying ppl talking jealousy following “clout game” No sociopath talking bc literally jeopardized community 5 Didn’t report mask less gatherings snitch  Sure really helps us get sent back Also deleted apology reuploaded sponsored amazon ad guess really cares 
165,Cornell dad here,fi71eo,412,"Hey everyone, 

I've been following this sub lately because my daughter is a student at Cornell.  (Dear old dad got his degree from the relatively pedestrian University of California system, so right off the bat, I'm not as smart as any of you)

We live in Texas, and my daughter arrived in Dallas last night on a previously planned weekend visit.  

We decided yesterday that it was probably wise for her to simply not return to campus, and we hoped for the best regarding scheduled mid-terms next week. 

I'm very relieved that the university decided to suspend classes today as she doesn't have to worry about negotiating with her professors.  We were really worried that if she went back on Monday, she might not be able to come back home at the end of March. 

Anywho, in following all your posts, I completely understand how stressed out everybody is.  This is certainly an unprecedented situation, and trust me, the old people are just as confused as you are and we're all trying to get through it. 

My heart goes out to the seniors who face missing graduation.  There is no spin to put on that -- it sucks. 

The best thing I can tell you is that someday when you have grandchildren, and you want to bore them to death with stories of the old days while you sip on your tipsy juice and they're getting all fidgety, this story in your lives is going to be a doozy. 

Hang tough Cornellians. It's (probably) not the end of the world.  And if it is, fuck it -- you got out of prelims for a while.  

Also, I think it's only fair that you declare both your men's and women's hockey teams national champions.  Hang those banners proudly! 

[To conclude, here's some sage advice from the days when I was a college student.](https://www.youtube.com/watch?v=b-EdiXP87uE)","Hey everyone, I've following sub lately daughter student Cornell. (Dear old dad got degree relatively pedestrian University California system, right bat, I'm smart you) We live Texas, daughter arrived Dallas last night previously planned weekend visit. We decided yesterday probably wise simply return campus, hoped best regarding scheduled mid-terms next week. I'm relieved university decided suspend classes today worry negotiating professors. We really worried went back Monday, might able come back home end March. Anywho, following posts, I completely understand stressed everybody is. This certainly unprecedented situation, trust me, old people confused we're trying get it. My heart goes seniors face missing graduation. There spin put -- sucks. The best thing I tell someday grandchildren, want bore death stories old days sip tipsy juice they're getting fidgety, story lives going doozy. Hang tough Cornellians. It's (probably) end world. And is, fuck -- got prelims while. Also, I think fair declare men's women's hockey teams national champions. Hang banners proudly! [To conclude, here's sage advice days I college student.](https://www.youtube.com/watch?v=b-EdiXP87uE)",Hey everyone Ive following sub lately daughter student Cornell Dear old dad got degree relatively pedestrian University California system right bat Im smart you We live Texas daughter arrived Dallas last night previously planned weekend visit We decided yesterday probably wise simply return campus hoped best regarding scheduled midterms next week Im relieved university decided suspend classes today worry negotiating professors We really worried went back Monday might able come back home end March Anywho following posts I completely understand stressed everybody is This certainly unprecedented situation trust me old people confused were trying get it My heart goes seniors face missing graduation There spin put  sucks The best thing I tell someday grandchildren want bore death stories old days sip tipsy juice theyre getting fidgety story lives going doozy Hang tough Cornellians Its probably end world And is fuck  got prelims while Also I think fair declare mens womens hockey teams national champions Hang banners proudly To conclude heres sage advice days I college studenthttpswwwyoutubecomwatchvbEdiXP87uE
166,Nice,tzhz7r,419,,,
167,Canvas every 45 minutes,mgo3li,416,,,
168,tl;dr version of Martha's email 4/22,g6vnih,415,"&#x200B;

https://preview.redd.it/lyavlzbz0nu41.png?width=562&format=png&auto=webp&s=6bf4529a1645169eb10682bc0f918b9ee3ec91a4",&#x200B; https://preview.redd.it/lyavlzbz0nu41.png?width=562&format=png&auto=webp&s=6bf4529a1645169eb10682bc0f918b9ee3ec91a4,x200B httpspreviewredditlyavlzbz0nu41pngwidth562formatpngautowebps6bf4529a1645169eb10682bc0f918b9ee3ec91a4
169,An unpopular opinion about COVID,rgjyyg,418,"Yes, this situation is horrible. Bad bad bad. And the administration is far from perfect.
I’m just taking a minute to think of all the people who are working around the clock to deal with this shitty mess.
All those who are running thousands (!!) of tests a day through a system that didn’t even exist a little while ago, in addition to the tasks that are actually in their job description.
All the people who are dealing with a massive surge of cases that have jumped far beyond record level, flooding the system.
All the people working from early morning to late at night calling those who are positive, putting hundreds of people in hotels, feeding them, making online exams, and so much more.
And sorry to their children and pets and friends who haven’t seen their person since this surge started.
Fuck COVID.","Yes, situation horrible. Bad bad bad. And administration far perfect. I’m taking minute think people working around clock deal shitty mess. All running thousands (!!) tests day system didn’t even exist little ago, addition tasks actually job description. All people dealing massive surge cases jumped far beyond record level, flooding system. All people working early morning late night calling positive, putting hundreds people hotels, feeding them, making online exams, much more. And sorry children pets friends haven’t seen person since surge started. Fuck COVID.",Yes situation horrible Bad bad bad And administration far perfect I’m taking minute think people working around clock deal shitty mess All running thousands  tests day system didn’t even exist little ago addition tasks actually job description All people dealing massive surge cases jumped far beyond record level flooding system All people working early morning late night calling positive putting hundreds people hotels feeding them making online exams much more And sorry children pets friends haven’t seen person since surge started Fuck COVID
