,Title,Id,Upvotes,body,body_clean,no_stops
0,Cornell Alert: Anyone know whats going on?,qov789,1113,"I just got a cornell alert saying to avoid the arts quad, anyone have any idea whats happening?

Everyone please be safe and hopefully this is resolved soon.

Edit: We are going to just get ahead of this and turn this into a megathread for this situation.

Edit 2: We put the subreddit into restricted mode temporarily to avoid the mountain of posts. New posts will not show up for now, but you can still comment

Edit 3: If you see people giving advice such as leaving where they are sheltered, please report it, we dont want people to get hurt for following bad advice. Everyone please stay safe and locked down unless directed to do otherwise by authorities.

Edit 4: Cornell confirmed that there is a bomb threat. We still dont know if there is anything else, so please stay safe and locked down.

Edit 5: We took the subreddit out of restricted mode. Still keep all stuff related to this in this thread, but you can post again. ","I got cornell alert saying avoid arts quad, anyone idea whats happening? Everyone please safe hopefully resolved soon. Edit: We going get ahead turn megathread situation. Edit 2: We put subreddit restricted mode temporarily avoid mountain posts. New posts show now, still comment Edit 3: If see people giving advice leaving sheltered, please report it, dont want people get hurt following bad advice. Everyone please stay safe locked unless directed otherwise authorities. Edit 4: Cornell confirmed bomb threat. We still dont know anything else, please stay safe locked down. Edit 5: We took subreddit restricted mode. Still keep stuff related thread, post again.",I got cornell alert saying avoid arts quad anyone idea whats happening Everyone please safe hopefully resolved soon Edit We going get ahead turn megathread situation Edit 2 We put subreddit restricted mode temporarily avoid mountain posts New posts show now still comment Edit 3 If see people giving advice leaving sheltered please report it dont want people get hurt following bad advice Everyone please stay safe locked unless directed otherwise authorities Edit 4 Cornell confirmed bomb threat We still dont know anything else please stay safe locked down Edit 5 We took subreddit restricted mode Still keep stuff related thread post again
1,I threw up in my mask and had to continue taking the prelim,qx9bkc,1057,"I emailed my chem prof about being very sick and he said I had to either take the prelim (as long as it’s not Covid) or they would give me a failing prelim grade. So I come to take the exam in person and low and behold I throw up halfway through into my mask and run to the bathroom. I come back out and he is waiting in the hallway, doesn’t say anything and I ask him if he has another mask as mine is ruined, he says no but that I can take it while holding a paper towel over my face for the rest of the time. He then asked if I was the one who emailed him and I say yes, he doesn’t say anything else. I ask if I can take the prelim in the hallway so i’m not spreading my germs on everyone and he says yes, so I finish the exam throwing up one more time during the time. 

another great look for the chem department🤠","I emailed chem prof sick said I either take prelim (as long it’s Covid) would give failing prelim grade. So I come take exam person low behold I throw halfway mask run bathroom. I come back waiting hallway, doesn’t say anything I ask another mask mine ruined, says I take holding paper towel face rest time. He asked I one emailed I say yes, doesn’t say anything else. I ask I take prelim hallway i’m spreading germs everyone says yes, I finish exam throwing one time time. another great look chem department🤠",I emailed chem prof sick said I either take prelim as long it’s Covid would give failing prelim grade So I come take exam person low behold I throw halfway mask run bathroom I come back waiting hallway doesn’t say anything I ask another mask mine ruined says I take holding paper towel face rest time He asked I one emailed I say yes doesn’t say anything else I ask I take prelim hallway i’m spreading germs everyone says yes I finish exam throwing one time time another great look chem department🤠
2,this professor gets it,k3ejjk,1053,,,
3,An actual summary of the 97 page report,hdvn9a,901,"I summarized their summary with most of the bits that affect students but I would still encourage you to read the report:

**Health Monitoring**

-	Daily check in (maybe live at https://dailycheck.cornell.edu/) for COVID symptoms.
-	Possibly require flu vaccine
-	Face masks policy live: https://ehs.cornell.edu/campus-health-safety/occupational-health/covid-19/face-covering-and-mask-requirements
-	Contact tracing recommended via phone app

**Testing**

-	Low threshold for testing including those in contact with Covid-positive cases
-	“Surveillance Testing” regularly testing students and staff
-	Test students before they travel to Ithaca (remotely) and when they arrive
-	Testing students already in Ithaca and during move-in. Move-in may be 4 or 8 days to accommodate
-	Reactivation of key card and NetID requires completing a checklist

**Quarantine/Isolation/Contact Tracing**

-	Quarantine at permanent residence or Ithaca hotels, including possibly the Statler
-	“Students should be provided immunity from university disciplinary violations for activities they disclose during contact tracing”

**Modifications to Academic Activities**

-	Later start to the school year, no breaks
-	2 modes of instruction: all online, and in-person with remote access
-	Classroom capacity reduced to 13-24%
-	Wear masks in classroom, sit in assigned seats (bruh)
-	Virtual OH encouraged
-	Barton Hall or other large spaces repurposed as quiet study spaces to limit gatherings elsewhere
-	Regular grading reinstated
-	Attendance shouldn’t be counted for credit but should be taken to facilitate contact tracing
-	Recommend a stricter cap to 18 credit hours for mental health
-	Orientation should focus on behavioral expectations

**Modifications to student life**

-	Student Organizations encouraged to do virtual activities, among other considerations
-	Greek Life: “The university should develop an addendum
to the Risk Management and Social Events
Policy that requires compliance with NYS
and local public health guidelines; wearing
masks when there are visitors in the house;
registration of public health monitors for
events; coordination with SCL to ensure
vendors are healthy and safe; and
registering the addresses of chapter
annexes.”
    - “Some advocated for strict enforcement with
strong sanctions, while others caution against
risks of pushing activities “underground” where
they may be more difficult to enforce.
Greek leaders expressed desire to be involved in
enforcement of behavioral expectations and
maintain close partnership with university
leadership. “
-	“The university should suspend in-person
concerts and lectures that involve outside
guests and promote innovative approaches
to entirely new ways of socializing while
distancing.”

**Housing**

-	Eliminate quads and triples.
-	Rooms assigned to bathrooms to reduce # of people sharing
-	Lounges and kitchens remain open
-	Dining halls provide to-go service, tables properly spaced, cutlery disposable, reservations required for dine-in

**De-densification**

-	“Campus can be de-densified by inviting only
some or none of students back for
residential instruction. If this option is
pursued, the following student groups
should be given priority: new students,
including transfer students; residential
advisors; graduating seniors (especially in
the spring); athletes (if competition will take
place for their sport); and students who would not otherwise be able to maintain
academic progress without access to
campus such as students in programs that
require hands-on access to special facilities
and those who lack access to internet or
quiet learning spaces at home”
    - Comments on this suggest it is not ideal. That is to say, they are proposing this as an option but NOT saying it is what should be done. In fact, the committee recommends AGAINST doing this. 

**”Campaign for Public Health and Behavioral Influence Strategies”**

-	“Recommend a system of progressive
sanctions. Initial response would involve
just the student and be educational.
Subsequent violations would involve
parent/legal guardian, if the student has
signed a FERPA waiver. Students could lose
access to university facilities and ultimately
be referred to the Office of the Judicial
Administrator for repeated violations that
necessitate formal discipline or removal
from enrollment”","I summarized summary bits affect students I would still encourage read report: **Health Monitoring** - Daily check (maybe live https://dailycheck.cornell.edu/) COVID symptoms. - Possibly require flu vaccine - Face masks policy live: https://ehs.cornell.edu/campus-health-safety/occupational-health/covid-19/face-covering-and-mask-requirements - Contact tracing recommended via phone app **Testing** - Low threshold testing including contact Covid-positive cases - “Surveillance Testing” regularly testing students staff - Test students travel Ithaca (remotely) arrive - Testing students already Ithaca move-in. Move-in may 4 8 days accommodate - Reactivation key card NetID requires completing checklist **Quarantine/Isolation/Contact Tracing** - Quarantine permanent residence Ithaca hotels, including possibly Statler - “Students provided immunity university disciplinary violations activities disclose contact tracing” **Modifications Academic Activities** - Later start school year, breaks - 2 modes instruction: online, in-person remote access - Classroom capacity reduced 13-24% - Wear masks classroom, sit assigned seats (bruh) - Virtual OH encouraged - Barton Hall large spaces repurposed quiet study spaces limit gatherings elsewhere - Regular grading reinstated - Attendance shouldn’t counted credit taken facilitate contact tracing - Recommend stricter cap 18 credit hours mental health - Orientation focus behavioral expectations **Modifications student life** - Student Organizations encouraged virtual activities, among considerations - Greek Life: “The university develop addendum Risk Management Social Events Policy requires compliance NYS local public health guidelines; wearing masks visitors house; registration public health monitors events; coordination SCL ensure vendors healthy safe; registering addresses chapter annexes.” - “Some advocated strict enforcement strong sanctions, others caution risks pushing activities “underground” may difficult enforce. Greek leaders expressed desire involved enforcement behavioral expectations maintain close partnership university leadership. “ - “The university suspend in-person concerts lectures involve outside guests promote innovative approaches entirely new ways socializing distancing.” **Housing** - Eliminate quads triples. - Rooms assigned bathrooms reduce # people sharing - Lounges kitchens remain open - Dining halls provide to-go service, tables properly spaced, cutlery disposable, reservations required dine-in **De-densification** - “Campus de-densified inviting none students back residential instruction. If option pursued, following student groups given priority: new students, including transfer students; residential advisors; graduating seniors (especially spring); athletes (if competition take place sport); students would otherwise able maintain academic progress without access campus students programs require hands-on access special facilities lack access internet quiet learning spaces home” - Comments suggest ideal. That say, proposing option NOT saying done. In fact, committee recommends AGAINST this. **”Campaign Public Health Behavioral Influence Strategies”** - “Recommend system progressive sanctions. Initial response would involve student educational. Subsequent violations would involve parent/legal guardian, student signed FERPA waiver. Students could lose access university facilities ultimately referred Office Judicial Administrator repeated violations necessitate formal discipline removal enrollment”",I summarized summary bits affect students I would still encourage read report Health Monitoring  Daily check maybe live httpsdailycheckcornelledu COVID symptoms  Possibly require flu vaccine  Face masks policy live httpsehscornelleducampushealthsafetyoccupationalhealthcovid19facecoveringandmaskrequirements  Contact tracing recommended via phone app Testing  Low threshold testing including contact Covidpositive cases  “Surveillance Testing” regularly testing students staff  Test students travel Ithaca remotely arrive  Testing students already Ithaca movein Movein may 4 8 days accommodate  Reactivation key card NetID requires completing checklist QuarantineIsolationContact Tracing  Quarantine permanent residence Ithaca hotels including possibly Statler  “Students provided immunity university disciplinary violations activities disclose contact tracing” Modifications Academic Activities  Later start school year breaks  2 modes instruction online inperson remote access  Classroom capacity reduced 1324  Wear masks classroom sit assigned seats bruh  Virtual OH encouraged  Barton Hall large spaces repurposed quiet study spaces limit gatherings elsewhere  Regular grading reinstated  Attendance shouldn’t counted credit taken facilitate contact tracing  Recommend stricter cap 18 credit hours mental health  Orientation focus behavioral expectations Modifications student life  Student Organizations encouraged virtual activities among considerations  Greek Life “The university develop addendum Risk Management Social Events Policy requires compliance NYS local public health guidelines wearing masks visitors house registration public health monitors events coordination SCL ensure vendors healthy safe registering addresses chapter annexes”  “Some advocated strict enforcement strong sanctions others caution risks pushing activities “underground” may difficult enforce Greek leaders expressed desire involved enforcement behavioral expectations maintain close partnership university leadership “  “The university suspend inperson concerts lectures involve outside guests promote innovative approaches entirely new ways socializing distancing” Housing  Eliminate quads triples  Rooms assigned bathrooms reduce  people sharing  Lounges kitchens remain open  Dining halls provide togo service tables properly spaced cutlery disposable reservations required dinein Dedensification  “Campus dedensified inviting none students back residential instruction If option pursued following student groups given priority new students including transfer students residential advisors graduating seniors especially spring athletes if competition take place sport students would otherwise able maintain academic progress without access campus students programs require handson access special facilities lack access internet quiet learning spaces home”  Comments suggest ideal That say proposing option NOT saying done In fact committee recommends AGAINST this ”Campaign Public Health Behavioral Influence Strategies”  “Recommend system progressive sanctions Initial response would involve student educational Subsequent violations would involve parentlegal guardian student signed FERPA waiver Students could lose access university facilities ultimately referred Office Judicial Administrator repeated violations necessitate formal discipline removal enrollment”
4,I am a New Bus!,tsqsuw,816,,,
5,URGENT: I can't get to my CS advisor after the split. What do I do?,n47exx,793,,,
6,I am Russian. Cornell feels like home,rk06lf,790,"1) Color is red  
2) Animal is bear  
3) Winter is cold  
4) People are stressed",1) Color red 2) Animal bear 3) Winter cold 4) People stressed,1 Color red 2 Animal bear 3 Winter cold 4 People stressed
7,People really needed to steal the CHEM 3590 finals?,njnku8,787,,,
8,Cold take,qzqqk9,756,"I know the importance of making our voices and demands heard, but we need to think of the direct consequences of the Do Better Cornell graffiti. Today it was freezing cold and snowing, and these two workers had to hand scrub the square outside Mann with water. We all are trying to raise awareness but the ones cleaning those signs aren’t Marta or Ryan, but the minimum wage workers of Cornell. And that doesn’t feel right, and to an extent against the whole point.","I know importance making voices demands heard, need think direct consequences Do Better Cornell graffiti. Today freezing cold snowing, two workers hand scrub square outside Mann water. We trying raise awareness ones cleaning signs aren’t Marta Ryan, minimum wage workers Cornell. And doesn’t feel right, extent whole point.",I know importance making voices demands heard need think direct consequences Do Better Cornell graffiti Today freezing cold snowing two workers hand scrub square outside Mann water We trying raise awareness ones cleaning signs aren’t Marta Ryan minimum wage workers Cornell And doesn’t feel right extent whole point
9,Cornell to name dorms after RBG and Toni Morrison.,j81j8e,750,,,
10,why wasn’t i warned,n6f4yk,749,,,
