,Title,Id,Upvotes,body,body_clean,no_stops
380,Petition to grade based on remaining BRB balance,fra9ll,332,"Much ado has been made over the various grading systems that Cornell could implement this semester, but I’m surprised that nobody has suggested the following policy that would both settle the grading debate and also the BRB problem faced by students:

All Cornell dining plans (that I’m aware of) provide students with some amount of BRB’s at the start of each semester. I propose that professors grade assignments as they normally would, but before returning grades to students they would multiply each student’s grade by the ratio of that student’s remaining BRB balance to the amount of BRB’s allocated to that student at the beginning of the semester. For example, say Bill has the House Meal Plan, which provides $400 in BRB’s per semester. If Bill has $200 remaining BRB’s and scores 100 on a test, then they would receive a final grade of a 50. This might seem unfair, but recognize that rationing is important in these times, not just of food, medicine, and toilet paper, but also of happiness. Bill experienced joy from spending $200 BRB’s throughout the semester, so the unhappiness he experiences when he receives a failing grade in a core class that he worked really hard in balances out his previously experienced joy, leaving Bill in a state of happiness equilibrium.

Of course, not all students have dining plans, so what should be made of their situation? Since these students have a level of detachment from Cornell and campus life, they should automatically get an “S” that stands for “Strange” because they’re not like the rest of us. If they want a letter grade then they should be given the opportunity to forsake personal economy in the name of conformity by signing up for a Cornell meal plan despite their inability to use it. 

One last point of interest is the fact that BRB’s carry over from fall semester to spring semester. Thus, one could theoretically have carried over BRB’s from fall semester and not spent many BRB’s from their current semester’s allotment and ended up with a BRB ratio greater than 1. There is no problem in this, as it rewards students who believed in the validity and growth of BRB’s as a currency. With the recent hits to the values of Bitcoin and other cryptocurrencies, allowing students to have, say, a 125% grade multiplier will assure that BRB’s don’t experience a similar drop in value faced by other mediums of exchange.

I shall bring forth this proposal directly to Martha, and I expect it to be adopted very soon. I apologize to any of you who spent all of your BRB’s at Bear Necessities or Jansen’s, but know that this plan is the only fair solution.","Much ado made various grading systems Cornell could implement semester, I’m surprised nobody suggested following policy would settle grading debate also BRB problem faced students: All Cornell dining plans (that I’m aware of) provide students amount BRB’s start semester. I propose professors grade assignments normally would, returning grades students would multiply student’s grade ratio student’s remaining BRB balance amount BRB’s allocated student beginning semester. For example, say Bill House Meal Plan, provides $400 BRB’s per semester. If Bill $200 remaining BRB’s scores 100 test, would receive final grade 50. This might seem unfair, recognize rationing important times, food, medicine, toilet paper, also happiness. Bill experienced joy spending $200 BRB’s throughout semester, unhappiness experiences receives failing grade core class worked really hard balances previously experienced joy, leaving Bill state happiness equilibrium. Of course, students dining plans, made situation? Since students level detachment Cornell campus life, automatically get “S” stands “Strange” they’re like rest us. If want letter grade given opportunity forsake personal economy name conformity signing Cornell meal plan despite inability use it. One last point interest fact BRB’s carry fall semester spring semester. Thus, one could theoretically carried BRB’s fall semester spent many BRB’s current semester’s allotment ended BRB ratio greater 1. There problem this, rewards students believed validity growth BRB’s currency. With recent hits values Bitcoin cryptocurrencies, allowing students have, say, 125% grade multiplier assure BRB’s don’t experience similar drop value faced mediums exchange. I shall bring forth proposal directly Martha, I expect adopted soon. I apologize spent BRB’s Bear Necessities Jansen’s, know plan fair solution.",Much ado made various grading systems Cornell could implement semester I’m surprised nobody suggested following policy would settle grading debate also BRB problem faced students All Cornell dining plans that I’m aware of provide students amount BRB’s start semester I propose professors grade assignments normally would returning grades students would multiply student’s grade ratio student’s remaining BRB balance amount BRB’s allocated student beginning semester For example say Bill House Meal Plan provides 400 BRB’s per semester If Bill 200 remaining BRB’s scores 100 test would receive final grade 50 This might seem unfair recognize rationing important times food medicine toilet paper also happiness Bill experienced joy spending 200 BRB’s throughout semester unhappiness experiences receives failing grade core class worked really hard balances previously experienced joy leaving Bill state happiness equilibrium Of course students dining plans made situation Since students level detachment Cornell campus life automatically get “S” stands “Strange” they’re like rest us If want letter grade given opportunity forsake personal economy name conformity signing Cornell meal plan despite inability use it One last point interest fact BRB’s carry fall semester spring semester Thus one could theoretically carried BRB’s fall semester spent many BRB’s current semester’s allotment ended BRB ratio greater 1 There problem this rewards students believed validity growth BRB’s currency With recent hits values Bitcoin cryptocurrencies allowing students have say 125 grade multiplier assure BRB’s don’t experience similar drop value faced mediums exchange I shall bring forth proposal directly Martha I expect adopted soon I apologize spent BRB’s Bear Necessities Jansen’s know plan fair solution
381,Can't believe this was taken less than a week ago,dvd0tx,338,,,
382,RUDE employee at Rose Dining,qvnbbz,333,"Has anyone else had run-ins with the man who sits at the booth to scan you in at Rose? He honestly took it way too far today. I’ve never seen an employee act so rude. The girl standing in front of me was confused about the container policy so she asked him a question and he was saying something but it was muffled (and really loud in the dining hall) so she politely asked him to repeat himself twice and he looked at her with the nastiest expression and goes “You’re not too bright are you?”

Excuse me?????? NO ONE deserves to be spoken to like that. Let alone at their university. By an employee. She was visibly shocked and he continued to say “Just go, this is too complicated for you to understand anyway” and made a swatting hand motion to shoo her away. This poor girl was near tears on the food line. Literally no one should have their night ruined like that. Where can I file a complaint about this???? He yelled at her, insulted her, and tried to talk shit about her to the other people on line??? Like sir I promise no one is on your side here. 

Also when I went a few days ago he was FILING HIS LONG CRUSTY NAILS at the booth. It was quite literally the most repulsive thing I’ve ever seen at a dining hall.","Has anyone else run-ins man sits booth scan Rose? He honestly took way far today. I’ve never seen employee act rude. The girl standing front confused container policy asked question saying something muffled (and really loud dining hall) politely asked repeat twice looked nastiest expression goes “You’re bright you?” Excuse me?????? NO ONE deserves spoken like that. Let alone university. By employee. She visibly shocked continued say “Just go, complicated understand anyway” made swatting hand motion shoo away. This poor girl near tears food line. Literally one night ruined like that. Where I file complaint this???? He yelled her, insulted her, tried talk shit people line??? Like sir I promise one side here. Also I went days ago FILING HIS LONG CRUSTY NAILS booth. It quite literally repulsive thing I’ve ever seen dining hall.",Has anyone else runins man sits booth scan Rose He honestly took way far today I’ve never seen employee act rude The girl standing front confused container policy asked question saying something muffled and really loud dining hall politely asked repeat twice looked nastiest expression goes “You’re bright you” Excuse me NO ONE deserves spoken like that Let alone university By employee She visibly shocked continued say “Just go complicated understand anyway” made swatting hand motion shoo away This poor girl near tears food line Literally one night ruined like that Where I file complaint this He yelled her insulted her tried talk shit people line Like sir I promise one side here Also I went days ago FILING HIS LONG CRUSTY NAILS booth It quite literally repulsive thing I’ve ever seen dining hall
383,I would like to submit a formal complaint regarding my fellow students.,l42oxr,334,"What the FUCK is up with people complaining about Cornell food? We are at one of the best places in the entire GODDAMN country for campus eats and some of you braindead philistines cant scrape together some of your silky smooth grey matter to find some decent grub on west campus. Time after time I hear someone whine about how there is never anything good on campus or how something is ""so so gross"". One, just pull up the eatery app, it's amazingly simple, and two, I'm sorry that you've eaten nothing but white bread toast with salt to the point where an ounce of seasoning at Risley is too much for your delicate taste buds. I mean GOD I'm so TORQUED out of my mind on Bang! energy right now I could SCREAM about how dumb some of you sound. Geez, Rebeccany, I'm so sorry Jeeves the Butler isn't here to lick your feet and make your family heirloom creamed spinach recipe, but you know what? You know what? You can take that creamed spinach and use it as lube for shoving your Canada Goose parka up that spoiled ass of yours.","What FUCK people complaining Cornell food? We one best places entire GODDAMN country campus eats braindead philistines cant scrape together silky smooth grey matter find decent grub west campus. Time time I hear someone whine never anything good campus something ""so gross"". One, pull eatery app, amazingly simple, two, I'm sorry eaten nothing white bread toast salt point ounce seasoning Risley much delicate taste buds. I mean GOD I'm TORQUED mind Bang! energy right I could SCREAM dumb sound. Geez, Rebeccany, I'm sorry Jeeves Butler lick feet make family heirloom creamed spinach recipe, know what? You know what? You take creamed spinach use lube shoving Canada Goose parka spoiled ass yours.",What FUCK people complaining Cornell food We one best places entire GODDAMN country campus eats braindead philistines cant scrape together silky smooth grey matter find decent grub west campus Time time I hear someone whine never anything good campus something so gross One pull eatery app amazingly simple two Im sorry eaten nothing white bread toast salt point ounce seasoning Risley much delicate taste buds I mean GOD Im TORQUED mind Bang energy right I could SCREAM dumb sound Geez Rebeccany Im sorry Jeeves Butler lick feet make family heirloom creamed spinach recipe know what You know what You take creamed spinach use lube shoving Canada Goose parka spoiled ass yours
384,Goodbye and good riddance to fall 2020,khyill,330,,,
385,Sage Chapel in Minecraft,gpr251,339,,,
386,finally got an internship!!,udzx4y,333,"after a long and hard recruiting cycle I’m happy to announce I landed an internship as a research assistant for a professor in the CIS department. 

the pay is pretty good (think $300-400 range PER week, more than I ever made selling knives). i just need to buy a few things for the professor and then I can start working. 

for those still looking for an internship rn it’s not too late and don’t give up. check your spam folder bc that’s where I found mine!","long hard recruiting cycle I’m happy announce I landed internship research assistant professor CIS department. pay pretty good (think $300-400 range PER week, I ever made selling knives). need buy things professor I start working. still looking internship rn it’s late don’t give up. check spam folder bc that’s I found mine!",long hard recruiting cycle I’m happy announce I landed internship research assistant professor CIS department pay pretty good think 300400 range PER week I ever made selling knives need buy things professor I start working still looking internship rn it’s late don’t give up check spam folder bc that’s I found mine
387,why will no one admit that Econ is actually really boring and just astrology for men,u6t55g,330,,,
388,That unreal sunset this afternoon,lwg4my,333,,,
389,Happy holiday season from bigredbun🥰,kjnjt1,333,,,
390,I REFUSE TO CONCEDE!,jw2r0s,334,,,
391,shoutout to the kids who are gonna wake up excited when they see snow for the first time,jmmt9h,335,"1) f\*\*\* the northerners who tease you bc they have forgotten how magical it is

2) you have no idea what's coming",1) f\*\*\* northerners tease bc forgotten magical 2) idea what's coming,1 f northerners tease bc forgotten magical 2 idea whats coming
392,happy halloween,jlr1as,332,but only to the girl walking through ctown dressed as a tcat bus. absolute icon,girl walking ctown dressed tcat bus. absolute icon,girl walking ctown dressed tcat bus absolute icon
393,as a current student...,ifz3wr,332,"  i am so proud of the aggressive tactics cornell is using to keep the campus safe. specifically, i would like to highlight their radical policy of telling students not to party and then hoping they don't. i believe with these tactics we can have a successful fall semester","proud aggressive tactics cornell using keep campus safe. specifically, would like highlight radical policy telling students party hoping don't. believe tactics successful fall semester",proud aggressive tactics cornell using keep campus safe specifically would like highlight radical policy telling students party hoping dont believe tactics successful fall semester
394,Waaaahhh I don’t wanna leave,fj7heb,329,,,
395,COVID-19 boosters will be required for the Spring 2022 semester,rliemq,332,,,
396,The feminine urge to,reh7db,338,"literally gaslight my kids like my parents have and exaggerate tf out of our Fall 2021 semester so I can say 
“back in my day we had bomb threats, gunman, 300 daily covid cases, nasal swabs twice a day, 1 psychiatrist for the whole student body and we still had to do good on our finals, honey you have it so good these days”","literally gaslight kids like parents exaggerate tf Fall 2021 semester I say “back day bomb threats, gunman, 300 daily covid cases, nasal swabs twice day, 1 psychiatrist whole student body still good finals, honey good days”",literally gaslight kids like parents exaggerate tf Fall 2021 semester I say “back day bomb threats gunman 300 daily covid cases nasal swabs twice day 1 psychiatrist whole student body still good finals honey good days”
397,Happy pride,nub3ko,332,,,
398,Cornell is the Best School in the World,ni2i91,331,"Fuck all the Harvard bots in this subreddit who try to decrease the prestige of our institution to lower future alumni engagement, decrease the size of our endowment, and then financially bully us into submission. Cornell is by far the greatest school in the world and if you disagree then you should stand behind your words and drop out. Students are supremely happy here and have access to the best mental health resources in the world. We have the best hotel school, best architecture school, best engineering program, best arboretum, best natural beauty, best parties, best campus food, and best students. The mods should do a better job at suppressing the fake negative sentiment, so our true greatest can shine through to the rest of the world.","Fuck Harvard bots subreddit try decrease prestige institution lower future alumni engagement, decrease size endowment, financially bully us submission. Cornell far greatest school world disagree stand behind words drop out. Students supremely happy access best mental health resources world. We best hotel school, best architecture school, best engineering program, best arboretum, best natural beauty, best parties, best campus food, best students. The mods better job suppressing fake negative sentiment, true greatest shine rest world.",Fuck Harvard bots subreddit try decrease prestige institution lower future alumni engagement decrease size endowment financially bully us submission Cornell far greatest school world disagree stand behind words drop out Students supremely happy access best mental health resources world We best hotel school best architecture school best engineering program best arboretum best natural beauty best parties best campus food best students The mods better job suppressing fake negative sentiment true greatest shine rest world
399,Last year in Duffield... can’t believe we used to do this,igiub6,329,,,
400,Cornell View: The crying corner in your dorm,g072zg,327,,,
401,Came back to my dorm and saw this heartwarming note!!! <3,s77snv,326,"&#x200B;

https://preview.redd.it/5s9n7fb3iic81.png?width=640&format=png&auto=webp&s=ffd80c90c9cfbbef7fe63a13dd0239ba6738a8ec",&#x200B; https://preview.redd.it/5s9n7fb3iic81.png?width=640&format=png&auto=webp&s=ffd80c90c9cfbbef7fe63a13dd0239ba6738a8ec,x200B httpspreviewreddit5s9n7fb3iic81pngwidth640formatpngautowebpsffd80c90c9cfbbef7fe63a13dd0239ba6738a8ec
402,New water feature @ Jameson,pylgrh,332,,,
403,POV: You’re a freshman at Cornell,pem4rt,333,,,
404,I haven't been on campus since March 2020. I miss it :(,kyz31z,331,,,
405,"for the sake of my karma, this is a joke",kagcqq,331,,,
406,Run...,eaf2lj,330,,,
407,Facts,fjo0xp,330,,,
408,"Okay, I am doubling down. Whoever found my 20w Ipad charger is willing to give it back to me, I will pay with sex. Although the sex might be awkward, It will be my first time.",r807zv,328,,,
409,This was posted last sem but feels even more pertinent now without a spring break,mg2b12,329,,,
410,YOU HAVE BEEN SPOTTED IN DUFFIELD HALL,m85n8i,330,,,
411,Advocate for yourselves against increased workload and unaccommodating professors,fxvy4x,324,"I’m a PhD student teaching an FWS (throwaway account). I’ve seen a lot of posts and comments about professors increasing the workload and not being accommodating to students’ needs during this crisis. I want you to know that your anger is completely justified and that this is absolutely not ok.

We as teachers/profs have received very strong guidelines about how to conduct the rest of the semester. We are required to be accommodating and very strongly encouraged to rework our syllabus and reduce the workload. I have personally cut the workload for my FWS significantly and I think all professors should do so. *Increasing* the workload is ludicrous and explicitly goes against Cornell’s guidelines.

I highly encourage undergraduates to organize and advocate for yourselves. In classes where professors are doing this, don’t just post on Reddit or complain to your friends. Advocate for yourselves. But be cautious about doing it alone: individual emails can single you out and expose you to possible backlash. Talk to other students. Collect and compile your complaints. Submit them to the professor, anonymously if necessary. And if your professor refuses to change, then take it to your department or your dean. I think they will put significant pressure on professors who are doing this. Change can and will happen if you organize.

If you do this, you might also want to reach out to Cornell Graduate Students United. As grad students we have our own major problems to deal with right now, but I think you would find support from us.

Good luck. Take care of yourselves and each other. We will make it through this together.","I’m PhD student teaching FWS (throwaway account). I’ve seen lot posts comments professors increasing workload accommodating students’ needs crisis. I want know anger completely justified absolutely ok. We teachers/profs received strong guidelines conduct rest semester. We required accommodating strongly encouraged rework syllabus reduce workload. I personally cut workload FWS significantly I think professors so. *Increasing* workload ludicrous explicitly goes Cornell’s guidelines. I highly encourage undergraduates organize advocate yourselves. In classes professors this, don’t post Reddit complain friends. Advocate yourselves. But cautious alone: individual emails single expose possible backlash. Talk students. Collect compile complaints. Submit professor, anonymously necessary. And professor refuses change, take department dean. I think put significant pressure professors this. Change happen organize. If this, might also want reach Cornell Graduate Students United. As grad students major problems deal right now, I think would find support us. Good luck. Take care other. We make together.",I’m PhD student teaching FWS throwaway account I’ve seen lot posts comments professors increasing workload accommodating students’ needs crisis I want know anger completely justified absolutely ok We teachersprofs received strong guidelines conduct rest semester We required accommodating strongly encouraged rework syllabus reduce workload I personally cut workload FWS significantly I think professors so Increasing workload ludicrous explicitly goes Cornell’s guidelines I highly encourage undergraduates organize advocate yourselves In classes professors this don’t post Reddit complain friends Advocate yourselves But cautious alone individual emails single expose possible backlash Talk students Collect compile complaints Submit professor anonymously necessary And professor refuses change take department dean I think put significant pressure professors this Change happen organize If this might also want reach Cornell Graduate Students United As grad students major problems deal right now I think would find support us Good luck Take care other We make together
412,Currently Forbidden Cornell View: Amaryllis in the Liberty Hyde Bailey Conservatory,gczuni,328,,,
413,This sub needs some more memes,b9guis,332,,,
414,Looking to make enemies,p2qqor,327,"I'm coming back to campus this fall, but I'm a bit disappointed that I don't have any enemies to fight. Unfortunately, I never made enemies freshman year, then covid hit and I stayed home fall 2020 and took a gap sem. I've seen posts on here of people looking for friends, so I thought I'd try to find an enemy myself. I'm mainly looking for male enemies (I'm male) to have verbal altercations with, to go to coffee shops, inconvenience each others' lives wherever we can, study separately, or anything else laidback that will eventually lead to a 400k word enemies to lovers slowburn. I enjoy dancing, cooking, and a great sense of humor. If there's any other guys out there who are similar, I'd love to talk!

Or if anyone has advice on how/where to make enemies, I'd greatly appreciate it :)","I'm coming back campus fall, I'm bit disappointed I enemies fight. Unfortunately, I never made enemies freshman year, covid hit I stayed home fall 2020 took gap sem. I've seen posts people looking friends, I thought I'd try find enemy myself. I'm mainly looking male enemies (I'm male) verbal altercations with, go coffee shops, inconvenience others' lives wherever can, study separately, anything else laidback eventually lead 400k word enemies lovers slowburn. I enjoy dancing, cooking, great sense humor. If there's guys similar, I'd love talk! Or anyone advice how/where make enemies, I'd greatly appreciate :)",Im coming back campus fall Im bit disappointed I enemies fight Unfortunately I never made enemies freshman year covid hit I stayed home fall 2020 took gap sem Ive seen posts people looking friends I thought Id try find enemy myself Im mainly looking male enemies Im male verbal altercations with go coffee shops inconvenience others lives wherever can study separately anything else laidback eventually lead 400k word enemies lovers slowburn I enjoy dancing cooking great sense humor If theres guys similar Id love talk Or anyone advice howwhere make enemies Id greatly appreciate 
415,a story in four parts,mx8qhc,327,,,
416,Statler W,lzw58i,327,,,
417,Hell yea cheers from Ithaca,lrsx1i,327,,,
418,Chimes just played the Jeopardy! theme :’),jr991x,326,It was really sad to hear about Alex Trebek’s passing so it was great to hear this in his memory- thanks again Chimesmaster.,It really sad hear Alex Trebek’s passing great hear memory- thanks Chimesmaster.,It really sad hear Alex Trebek’s passing great hear memory thanks Chimesmaster
